title,release_date,genres,overview,popularity,vote_average,vote_count
Deadpool The Musical 2 - Ultimate Disney Parody!,2018-07-10,"Music, Action, Comedy","Watch as Deadpool sings and slays his way through a series of Disney songs and superhero teams, from The X-Men to The Avengers & more!",399.478,9.5,3
Harry Potter and the Prisoner of Azkaban,2004-05-31,"Adventure, Fantasy","Year three at Hogwarts means new fun and challenges as Harry learns the delicate art of approaching a Hippogriff, transforming shape-shifting Boggarts into hilarity and even turning back time. But the term also brings danger: soul-sucking Dementors hover over the school, an ally of the accursed He-Who-Cannot-Be-Named lurks within the castle walls, and fearsome wizard Sirius Black escapes Azkaban. And Harry will confront them all.",239.938,8.019,21132
Spider-Man: No Way Home,2021-12-15,"Action, Adventure, Science Fiction","Peter Parker is unmasked and no longer able to separate his normal life from the high-stakes of being a super-hero. When he asks for help from Doctor Strange the stakes become even more dangerous, forcing him to discover what it truly means to be Spider-Man.",354.841,7.962,19659
Elemental,2023-06-14,"Animation, Comedy, Family, Fantasy, Romance","In a city where fire, water, land and air residents live together, a fiery young woman and a go-with-the-flow guy will discover something elemental: how much they have in common.",295.358,7.656,4225
May the 12th Be with You,2024-05-09,"Animation, Comedy","It's Mother's Day and Marge Simpson joins the moms of Disney+ on a special holiday outing that turns into an epic galactic adventure filled with heroes, villains, and Stewie from Family Guy.",276.589,5.586,35
Handling the Undead,2024-02-09,"Horror, Drama, Mystery","On a hot summer day in Oslo, the dead mysteriously awaken, and three families are thrown into chaos when their deceased loved ones come back to them. Who are they, and what do they want?",307.611,6.7,45
Wonka,2023-12-06,"Comedy, Family, Fantasy","Willy Wonka – chock-full of ideas and determined to change the world one delectable bite at a time – is proof that the best things in life begin with a dream, and if you’re lucky enough to meet Willy Wonka, anything is possible.",284.285,7.165,3210
The Hunted,2024-01-18,"Horror, Thriller","After their boat capsizes in the Mediterranean Sea, a group of refugees are rescued by rich Europeans who offer them shelter on an idyllic island. But the miracle soon becomes a nightmare when the saviors turn into ruthless manhunters.",375.82,6.645,31
Madame Web,2024-02-14,"Action, Fantasy","Forced to confront revelations about her past, paramedic Cassandra Webb forges a relationship with three young women destined for powerful futures...if they can all survive a deadly present.",277.863,5.563,1568
Transformers: Rise of the Beasts,2023-06-06,"Science Fiction, Adventure, Action","When a new threat capable of destroying the entire planet emerges, Optimus Prime and the Autobots must team up with a powerful faction known as the Maximals. With the fate of humanity hanging in the balance, humans Noah and Elena will do whatever it takes to help the Transformers as they engage in the ultimate battle to save Earth.",231.271,7.324,4375
Despicable Me,2010-07-08,"Family, Animation, Comedy","Villainous Gru lives up to his reputation as a despicable, deplorable and downright unlikable guy when he hatches a plan to steal the moon from the sky. But he has a tough time staying on task after three orphans land in his care.",252.781,7.243,14785
Fast X,2023-05-17,"Action, Crime, Thriller","Over many missions and against impossible odds, Dom Toretto and his family have outsmarted, out-nerved and outdriven every foe in their path. Now, they confront the most lethal opponent they've ever faced: A terrifying threat emerging from the shadows of the past who's fueled by blood revenge, and who is determined to shatter this family and destroy everything—and everyone—that Dom loves, forever.",336.854,7.107,5350
No Time to Spy: A Loud House Movie,2024-06-21,"Animation, Action, Adventure, Comedy, Family","Lincoln and the Louds are ecstatic to welcome their new Gran-Gran, Myrtle, into the family with a tropical wedding celebration; but the festivities are cut short when an old nemesis from Myrtle's secret agent past appears on the island.",260.035,6.4,24
Love Lies Bleeding,2024-03-08,"Crime, Romance, Thriller","Reclusive gym manager Lou falls hard for Jackie, an ambitious bodybuilder headed through town to Las Vegas in pursuit of her dream. But their love ignites violence, pulling them deep into the web of Lou’s criminal family.",266.602,6.585,381
La Familia del Barrio: La Película,2024-06-28,"Comedy, Animation",El Noruego travels back in time and accidentally prevents the War of Independence by getting Miguel Hidalgo drunk before giving the cry.,283.559,7.826,23
Alienoid,2022-07-20,"Science Fiction, Action, Fantasy, Adventure","Gurus in the late Goryeo dynasty try to obtain a fabled, holy sword, and humans in 2022 hunt down an alien prisoner that is locked in a human's body. The two parties cross paths when a time-traveling portal opens up.",260.477,6.9,380
Abigail,2024-04-16,"Horror, Thriller","A group of criminals kidnaps a teenage ballet dancer, the daughter of a notorious gang leader, in order to obtain a ransom of $50 million, but over time, they discover that she is not just an ordinary girl. After the kidnappers begin to diminish, one by one, they discover, to their increasing horror, that they are locked inside with an unusual girl.",251.75,6.8,891
The Boy and the Heron,2023-07-14,"Animation, Adventure, Fantasy","While the Second World War rages, the teenage Mahito, haunted by his mother's tragic death, is relocated from Tokyo to the serene rural home of his new stepmother Natsuko, a woman who bears a striking resemblance to the boy's mother. As he tries to adjust, this strange new world grows even stranger following the appearance of a persistent gray heron, who perplexes and bedevils Mahito, dubbing him the ""long-awaited one.""",248.315,7.526,1486
Pirates of the Caribbean: The Curse of the Black Pearl,2003-07-09,"Adventure, Fantasy, Action","Jack Sparrow, a freewheeling 18th-century pirate, quarrels with a rival pirate bent on pillaging Port Royal. When the governor's daughter is kidnapped, Sparrow decides to help the girl's love save her.",241.736,7.804,20215
The Maze Runner,2014-09-10,"Action, Mystery, Science Fiction, Thriller","Set in a post-apocalyptic world, young Thomas is deposited in a community of boys after his memory is erased, soon learning they're all trapped in a maze that will require him to join forces with fellow “runners” for a shot at escape.",260.565,7.184,16677
Kleks Academy,2024-01-05,"Fantasy, Adventure, Family","A seemingly ordinary girl finds her way into the eponymous Academy to explore the world of fairy tales, imagination and creativity. With the help of a crazy, talented teacher, she develops her unique abilities and also stumbles upon a clue that will help her unravel the biggest secret of the family...",282.668,6.452,84
Justice League: Crisis on Infinite Earths Part Two,2024-04-23,"Animation, Science Fiction, Action","An endless army of shadow demons bent on the destruction of all reality swarms over our world and all parallel Earths! The only thing opposing them is the mightiest team of metahumans ever assembled. But not even the combined power of Superman, Batman, Wonder Woman, Green Lantern and all their fellow superheroes can slow down the onslaught of this invincible horde. What mysterious force is driving them? And how do the long-buried secrets of the Monitor and Supergirl threaten to crush our last defense?",258.245,6.953,139
xXx: Return of Xander Cage,2017-01-13,"Action, Adventure, Crime","Extreme athlete turned government operative Xander Cage comes out of self-imposed exile, thought to be long dead, and is set on a collision course with deadly alpha warrior Xiang and his team in a race to recover a sinister and seemingly unstoppable weapon known as Pandora's Box. Recruiting an all-new group of thrill-seeking cohorts, Xander finds himself enmeshed in a deadly conspiracy that points to collusion at the highest levels of world governments.",345.075,6.131,8749
Harry Potter and the Philosopher's Stone,2001-11-16,"Adventure, Fantasy","Harry Potter has lived under the stairs at his aunt and uncle's house his whole life. But on his 11th birthday, he learns he's a powerful wizard—with a place waiting for him at the Hogwarts School of Witchcraft and Wizardry. As he learns to harness his newfound powers with the help of the school's kindly headmaster, Harry uncovers the truth about his parents' deaths—and about the villain who's to blame.",223.775,7.9,26849
Ghostbusters: Frozen Empire,2024-03-20,"Fantasy, Adventure, Comedy","When the discovery of an ancient artifact unleashes an evil force, Ghostbusters new and old must join forces to protect their home and save the world from a second Ice Age.",229.308,6.665,1144
Pleasure,2021-10-08,Drama,"19 year old Linnéa leaves her small town in Sweden and heads for Los Angeles with the aim of becoming the world's next big porn star, but the road to her goal turns out to be bumpier than she imagined.",237.398,6.227,488
