adult,backdrop_path,belongs_to_collection,budget,genres,homepage,id,imdb_id,origin_country,original_language,original_title,overview,popularity,poster_path,production_companies,production_countries,release_date,revenue,runtime,spoken_languages,status,tagline,title,video,vote_average,vote_count,actors_actresses
False,/xOMo8BRK7PfcJv9JCnx7s5hj0PX.jpg,"{'id': 726871, 'name': 'Dune Collection', 'poster_path': '/c1AiZTXyyzmPOlTLSubp7CEeYj.jpg', 'backdrop_path': '/ygVSGv86R0BTOKJIb8RQ1sFxs4q.jpg'}",190000000,[],https://www.dunemovie.com,693134,tt15239678,['US'],en,Dune: Part Two,"Follow the mythic journey of Paul Atreides as he unites with Chani and the Fremen while on a path of revenge against the conspirators who destroyed his family. Facing a choice between the love of his life and the fate of the known universe, Paul endeavors to prevent a terrible future only he can foresee.",394.699,/1pdfLvkbY9ohJlCjQH2CZjjYVvJ.jpg,"[{'id': 923, 'logo_path': '/8M99Dkt23MjQMTTWukq4m5XsEuo.png', 'name': 'Legendary Pictures', 'origin_country': 'US'}]","[{'iso_3166_1': 'US', 'name': 'United States of America'}]",2024-02-27,711844359,167,"[{'english_name': 'English', 'iso_639_1': 'en', 'name': 'English'}]",Released,Long live the fighters.,Dune: Part Two,False,8.166,4904,"['Timothée Chalamet', 'Zendaya', 'Rebecca Ferguson', 'Javier Bardem', 'Josh Brolin']"
False,/gsljBGOjBkbuNt3gvIDXQWnudn.jpg,,0,[],https://www.youtube.com/watch?v=Z5ezsReZcxU,558144,tt6612630,['US'],en,Deadpool: No Good Deed,"Deadpool sees an opportunity to save the day, but it doesn't go entirely as planned.",393.236,/wlKU9yB0Q8nfPMakBcSBT0JGS7.jpg,"[{'id': 25, 'logo_path': '/qZCc1lty5FzX30aOCVRBLzaVmcp.png', 'name': '20th Century Fox', 'origin_country': 'US'}]","[{'iso_3166_1': 'US', 'name': 'United States of America'}]",2017-03-03,0,4,"[{'english_name': 'English', 'iso_639_1': 'en', 'name': 'English'}]",Released,,Deadpool: No Good Deed,False,7.147,483,"['Ryan Reynolds', 'Stan Lee']"
False,/2KGxQFV9Wp1MshPBf8BuqWUgVAz.jpg,,72000000,[],https://www.migration.movie,940551,tt6495056,['US'],en,Migration,"After a migrating duck family alights on their pond with thrilling tales of far-flung places, the Mallard family embarks on a family road trip, from New England, to New York City, to tropical Jamaica.",386.42,/ldfCF9RhR40mppkzmftxapaHeTo.jpg,"[{'id': 33, 'logo_path': '/8lvHyhjr8oUKOOy2dKXoALWKdp0.png', 'name': 'Universal Pictures', 'origin_country': 'US'}, {'id': 6704, 'logo_path': '/fOG2oY4m1YuYTQh4bMqqZkmgOAI.png', 'name': 'Illumination', 'origin_country': 'US'}, {'id': 1778, 'logo_path': '/b5rT6VbYza3LyfltCmz1OcqzWJM.png', 'name': 'dentsu', 'origin_country': 'JP'}, {'id': 3341, 'logo_path': '/dTG5dXE1kU2mpmL9BNnraffckLU.png', 'name': 'Fuji Television Network', 'origin_country': 'JP'}]","[{'iso_3166_1': 'US', 'name': 'United States of America'}]",2023-12-06,298776052,83,"[{'english_name': 'English', 'iso_639_1': 'en', 'name': 'English'}]",Released,Odd ducks welcome.,Migration,False,7.46,1575,"['Kumail Nanjiani', 'Elizabeth Banks', 'Caspar Jennings', 'Tresi Gazal', 'Awkwafina']"
False,/oX1tNrdqw7kv564QluIbP9yd47H.jpg,,0,[],http://www.animate-onlineshop.jp/special/vassalord/pc/,444483,tt2998536,['JP'],ja,ヴァッサロード,"Charley, a cyborg vampire who does the Vatican's dirty work, is the thrall of the local vampire playboy Johnny Rayflo. As the two fight crime—and each other—hilarity, violence and sacrilege ensue! But can Charley resist his own desperate cravings for blood? Find out as the devilish duo go up aginst a childlike vampire princess, a mysterious branch of the Unitarian Church...and one another.",381.322,/vyzS55N83jgDtgMeyYJOD7ppYMz.jpg,"[{'id': 529, 'logo_path': '/rwB6w2aPENQbx756pBWSw44Ouk.png', 'name': 'Production I.G', 'origin_country': 'JP'}]","[{'iso_3166_1': 'JP', 'name': 'Japan'}]",2013-03-15,0,28,"[{'english_name': 'Japanese', 'iso_639_1': 'ja', 'name': '日本語'}]",Released,,Vassalord.,False,5.0,10,"['Keiji Fujiwara', 'Ryotaro Okiayu', 'Mai Kadowaki', 'Rina Sato', 'Misa Kobayashi']"
False,/oavbmL3iddJUmC8nQjL6bLHwAP4.jpg,,8000000,[],https://www.tarotmovie.com,719221,tt14088510,['US'],en,Tarot,"When a group of friends recklessly violate the sacred rule of Tarot readings, they unknowingly unleash an unspeakable evil trapped within the cursed cards. One by one, they come face to face with fate and end up in a race against death.",379.248,/gAEUXC37vl1SnM7PXsHTF23I2vq.jpg,"[{'id': 3287, 'logo_path': '/bz6GbCQQXGNE56LTW9dwgksW0Iw.png', 'name': 'Screen Gems', 'origin_country': 'US'}, {'id': 10067, 'logo_path': '/p1kZoVNfkVvk7xyJZEposRxcfh8.png', 'name': 'Alloy Entertainment', 'origin_country': 'US'}, {'id': 95434, 'logo_path': '/iKqEhbzYfb6YHwRlhqcvX1NIZbt.png', 'name': 'Ground Control Entertainment', 'origin_country': 'US'}, {'id': 154063, 'logo_path': '/r4anaxYa8OL5KaUbU35VkrIe88L.png', 'name': 'Capstone Pictures', 'origin_country': 'US'}]","[{'iso_3166_1': 'US', 'name': 'United States of America'}]",2024-05-01,48027934,92,"[{'english_name': 'English', 'iso_639_1': 'en', 'name': 'English'}]",Released,Your fate is in the cards.,Tarot,False,6.707,714,"['Harriet Slater', 'Adain Bradley', 'Avantika', 'Jacob Batalon', 'Humberly González']"
False,/6HpRZeA0JdY5fRgl89KKExsvvwR.jpg,,0,[],https://www.disneyplus.com/movies/young-woman-and-the-sea/7RtNXnCiH1PG,774531,tt5177114,['US'],en,Young Woman and the Sea,"This is the extraordinary true story of Trudy Ederle, the first woman to successfully swim the English Channel. Through the steadfast support of her older sister and supportive trainers, she overcame adversity and the animosity of a patriarchal society to rise through the ranks of the Olympic swimming team and complete the 21-mile trek from France to England.",371.524,/bZlecCuBVvKuarNGvchBwaOsQ3c.jpg,"[{'id': 2, 'logo_path': '/wdrCwmRnLFJhEoH8GSfymY85KHT.png', 'name': 'Walt Disney Pictures', 'origin_country': 'US'}, {'id': 130, 'logo_path': '/c9dVHPOL3cqCr2593Ahk0nEKTEM.png', 'name': 'Jerry Bruckheimer Films', 'origin_country': 'US'}]","[{'iso_3166_1': 'US', 'name': 'United States of America'}]",2024-05-31,581725,129,"[{'english_name': 'English', 'iso_639_1': 'en', 'name': 'English'}]",Released,Defy the odds.,Young Woman and the Sea,False,7.755,102,"['Daisy Ridley', 'Tilda Cobham-Hervey', 'Stephen Graham', 'Kim Bodnia', 'Jeanette Hain']"
False,/Ahn9zBmRImn0uJ17IuQugjywQZB.jpg,,0,[],,959098,tt16740144,['FR'],fr,Le Dernier Jaguar,"Grown up in the Amazon rainforest, Autumn lives with Hope, the cute baby jaguar she adopted. However, a circumstance forces Autumn to return to New York. Autumn goes back into the jungle to save Hope from grave danger.",367.153,/ocHu00nOZzK0m9BsFdrFg3SglS0.jpg,"[{'id': 73974, 'logo_path': None, 'name': 'Mai Juin Productions', 'origin_country': 'FR'}]","[{'iso_3166_1': 'FR', 'name': 'France'}]",2024-02-01,0,100,"[{'english_name': 'English', 'iso_639_1': 'en', 'name': 'English'}, {'english_name': 'French', 'iso_639_1': 'fr', 'name': 'Français'}]",Released,,Autumn and the Black Jaguar,False,5.6,29,"['Lumi Pollack', 'Emily Bett Rickards', 'Wayne Charles Baker', 'Paul Greene', 'Kelly Hope Taylor']"
